techcrunch|819761170622152704|2017-01-13 04:21:08|SoundCloud co-founder takes product role, Yahoo alum steps in as CTO https://t.co/UlLISIggDn
techcrunch|819758009765068800|2017-01-13 04:08:34|The Nintendo Switch will cost $300 and release worldwide on March 3 https://t.co/nhoZmqnFE4
techcrunch|819756050442321921|2017-01-13 04:00:47|"Crunch Report | Lily Robotics Shuts Down https://t.co/9ch9t1X4S1 by @titoyooo"
techcrunch|819754879161921536|2017-01-13 03:56:08|Verifone, FIS and Modo are creating a new way for consumers to pay with loyalty points https://t.co/6Uybvuufe9
techcrunch|819754315086635009|2017-01-13 03:53:53|Kaggle hosting $1M competition to improve lung cancer detection with machine learning  https://t.co/RnWIJgj6sr by @JohnMannes
techcrunch|819748064021843971|2017-01-13 03:29:03|Fitbit reportedly tried to buy Jawbone late last year https://t.co/GU5qX5ebed
techcrunch|819742012169719817|2017-01-13 03:05:00|NYC’s Citi Bikes piloting Blaze’s biking safety projection lights https://t.co/xh5lDMcs0v
techcrunch|819735978952761346|2017-01-13 02:41:01|Facebook Pages can now “go live” from the desktop, add live contributors and more https://t.co/KsEI2mE26y
techcrunch|819732197548572672|2017-01-13 02:26:00|SF District Attorney lawsuit against Lily may have prompted refund https://t.co/8bjzzmnhCo
techcrunch|819730121519022080|2017-01-13 02:17:45|Tesla details how it’ll charge new owners to use Superchargers https://t.co/4Sv0htircC by @grg
techcrunch|819729712280965120|2017-01-13 02:16:07|Boom shows off its XB-1 supersonic demonstration passenger airliner https://t.co/1eI6UzBq2f https://t.co/L2UH19cYZX
techcrunch|819723169066008578|2017-01-13 01:50:07|Report: EU unhappy with US response to Yahoo email scanning scandal https://t.co/eqikozv8HY
techcrunch|819716612525846528|2017-01-13 01:24:04|Twitter to live stream Trump’s inauguration in partnership with PBS https://t.co/1FYh7T7ujL
techcrunch|819712607082811392|2017-01-13 01:08:09|Lily drones shuts down, Twitter to stream Trump inauguration and more on #CrunchReport with @titoyooo https://t.co/iCGbt1Hzef
techcrunch|819710659093000192|2017-01-13 01:00:25|Apple said to be seriously pursuing Netflix-style scripted TV and movies https://t.co/dWNhz3lhgu
techcrunch|819704524147486720|2017-01-13 00:36:02|Amazon launches the first of its own subscription VOD channels, Anime Strike https://t.co/ghHRRMFdAR
techcrunch|819698011148349440|2017-01-13 00:10:09|"Article recommendation startup ZergNet adds sponsored links, but promises to remain ""content only"" https://t.co/ez1Y6jnFO3 by @anthonyha"
techcrunch|819697988222283776|2017-01-13 00:10:04|Stadium Goods raises $4.6 million to sell sought-after sneakers and streetwear https://t.co/k2hLV35ArO
techcrunch|819691696799805440|2017-01-12 23:45:04|Google’s Toontastic storytelling app for kids goes 3D https://t.co/0dxuv2RnGP
techcrunch|819685404672753665|2017-01-12 23:20:04|Smize! Tyra Banks emojis are here https://t.co/8sNz8tBL0p
techcrunch|819684746410102785|2017-01-12 23:17:27|Radpad gets acquired by LandLord Station after nearly shutting down https://t.co/dFJddojp2G by @Katie_Roof
techcrunch|819683420003450881|2017-01-12 23:12:10|Snapchat launches universal search https://t.co/C0o8DbC6ND by @joshconstine
techcrunch|819681374579720192|2017-01-12 23:04:03|Smartwatches could soon tell you when you're getting sick https://t.co/y1DFKlujf1
techcrunch|819679878265962496|2017-01-12 22:58:06|Pandora is laying off 7% of its workforce https://t.co/QPyMMYnrdY by @mattlynley
techcrunch|819678937441861632|2017-01-12 22:54:22|Consumer Reports now recommends the MacBook Pro after a software fix https://t.co/ScYvsoQTIt by @bheater
techcrunch|819678615633858560|2017-01-12 22:53:05|Do funny recruiting hacks work? Let’s ask a guy who tried https://t.co/sqQDj0ooD4
techcrunch|819672877511430145|2017-01-12 22:30:17|Opera launches Neon, a new experimental desktop browser https://t.co/vLQFYnJxqj
techcrunch|819672120863191040|2017-01-12 22:27:17|Where to watch Nintendo’s Switch events https://t.co/u7ycAuIf5C by @bheater
techcrunch|819666787499474944|2017-01-12 22:06:05|Madrona appoints Microsoft’s former developer division chief as managing partner https://t.co/OLkK4t4YyM
techcrunch|819659587846447104|2017-01-12 21:37:28|Google's Key Transparency project aims to ease a tough task in cryptography https://t.co/HzbM5xYRLU
techcrunch|819654440198160384|2017-01-12 21:17:01|Alphabet's Eric Schmidt heads to Trump Tower (again) https://t.co/FWDHiWboBy by @tayhatmaker
techcrunch|819652379419164672|2017-01-12 21:08:50|With billions of dollars at stake, Merck and Palantir partner to discover drugs faster https://t.co/FidxZitAWr by @cookie
