cherdantsev|866726769470181376|2017-05-22 18:45:39|Денис Глушаков - лучший игрок сезона по версии РФС. Молодчина, Дэн! #рфпл #спартак https://t.co/XJ1j6Du7yh
cherdantsev|866691421377634306|2017-05-22 16:25:11|Искренне желаю Краснодару, чтобы завтра на встрече Путина с Инфантино произошло чудо. Стадион Краснодар достоин того, чтобы принять матчи ЧМ
cherdantsev|866643105361035264|2017-05-22 13:13:12|Умер В.И.Перетурин. Он первым стал наполнять репортажи иронией, и тем самым внёс большой вклад а развитие комментаторского ремесла...
cherdantsev|866557636396843008|2017-05-22 07:33:35|Есть, чем заняться летом на даче... https://t.co/dlU02Gpqb3
cherdantsev|866357913639636995|2017-05-21 18:19:57|RT @ANobelito: Неповторимый! https://t.co/npQAjYXkaO
cherdantsev|866320452435804160|2017-05-21 15:51:05|"RT @MatchTV: Денис Глушаков забил лучший гол сезона по версии зрителей программы ""После футбола"" с Георгием Черданцевым 

ВИДЕО

https://t.…"
cherdantsev|866291448328663040|2017-05-21 13:55:50|Вместе с главным тренером сборной поздравляем всех с окончанием чемпионата! Ура, товарищи! #РФПЛ https://t.co/47LYjbbdHl
cherdantsev|866272442553176064|2017-05-21 12:40:19|Будет смешно, если Спартак сравняет и Арсенал вылетит вместе со своим клоуном-пенальтистом😱Ударь попроще, 3:0 и закрывай лавочку!
cherdantsev|866264930999312384|2017-05-21 12:10:28|В 17.10 на @MatchTV главный тренер сборной России Станислав Черчесов. Все голы последнего тура и ожидание старта #КК2017
cherdantsev|865958010740498434|2017-05-20 15:50:53|Не бросайтесь в футболистов...
cherdantsev|865937675924234241|2017-05-20 14:30:04|Разложили как детей! Это пять!!!#РоссияКанада #ЧМ2017
cherdantsev|865822126972055552|2017-05-20 06:50:55|Пальцы Ларса Ульриха после концерта. 😱 https://t.co/2ASpoYRTgf
cherdantsev|865580328584445954|2017-05-19 14:50:06|Мегафон сегодня напомнил о временах со стационарными телефонами и автоматами за 2 копейки. Как жили? Непонятно...
cherdantsev|865530557442146304|2017-05-19 11:32:20|"RT @tina_kandelaki: Александр Елагин: Из тех СМИ, которые написали якобы о моем ""увольнении"", никто не обратился ко мне за комментарием! ht…"
cherdantsev|865196138831466496|2017-05-18 13:23:28|"RT @MatchTV: Выберите лучший гол мая вместе с программой ""После футбола"" с Георгием Черданцевым @cherdantsev 

https://t.co/2EDTQEHK7Q http…"
cherdantsev|865113045189656576|2017-05-18 07:53:17|"Историческое решение! Сегодня может быть принято решение о дисквалификации в АПЛ ""ныряльщиков"" на основании видеоза… https://t.co/kCvh3sPBLz"
cherdantsev|864933745442291713|2017-05-17 20:00:49|Луческу сегодня сказал всё. 23.50 на @MatchTV https://t.co/jWFBmKYIxY
cherdantsev|864929503033909252|2017-05-17 19:43:57|"Из понравившегося: ""Только что мужик пронёс мимо меня  к метро штангу ворот"""
cherdantsev|864920643468492801|2017-05-17 19:08:45|Раздевалка Спартака прямо сейчас. Подробнее в 23.50 на @MatchTV https://t.co/7VXqjur5GR
cherdantsev|864917159901880325|2017-05-17 18:54:54|Сразу после финала Кубка Италии на @MatchTV https://t.co/YhPaK7sjba
cherdantsev|864890307464310785|2017-05-17 17:08:12|Обзор всех матчей 29 тура сразу после финала Кубка Италии примерно в 23.50 на @MatchTV https://t.co/Kux1T1AEkn
cherdantsev|864851433262395393|2017-05-17 14:33:44|@VasilyKonov То что немцы приедут вторым составом, было известно ещё полгода назад
cherdantsev|864738361340121088|2017-05-17 07:04:26|@AShmurnov Я думаю это трудности перевода: Аленичев ему не звонил, Романцев пусть язык выучит. Он не производит такого впечатления.
cherdantsev|864504418942767104|2017-05-16 15:34:49|Я за хоккеем не очень слежу, но вот открыл для себя Шипачева. Абсолютно футбольные понимание игры и передачи от него! 👍👍👍#ЧМ2017 #РоссияСША
cherdantsev|864501014526930944|2017-05-16 15:21:18|Судя по обстановке на трибунах в Кёльне на хоккее - а в Германии живет ещё кто-то, кроме русских? #ЧМ2017 #РоссияСША
cherdantsev|864490461435658240|2017-05-16 14:39:22|@AShmurnov @stan_minin По какой аналогии? Во французском есть только одно правило чтения дифтонга au. По-английски… https://t.co/kOSN8cD4ie
cherdantsev|864020332151271425|2017-05-15 07:31:14|Вот с таким выражением лица он ушёл с поля после победы видимо в последнем своём большом домашнем матче в карьере.… https://t.co/vbgvWdRwAB
cherdantsev|863850087180640257|2017-05-14 20:14:44|Зря Каррера торопился на Ювентус, который решил стать чемпионом дома и отдать прямую путёвку в ЛЧ Роме, а не Наполи. #ювентус #Каррера
cherdantsev|863814230885228544|2017-05-14 17:52:16|Прямо сейчас на Матч ТВ! #спартак #каррера #рфпл @ Tvcenter OSTANKINO https://t.co/P9TiSlNTRY
cherdantsev|863809132951941120|2017-05-14 17:32:00|Через полчаса полный эксклюзив на @MatchTV. Не только о Спартаке. Также Лига чемпионов, Челси и другое) https://t.co/VR3HTwWDh3
cherdantsev|863710960980250625|2017-05-14 11:01:54|Кстати, Линекер не поведёт последний эфир сезона голым, стоя на голове, Ширер и Райт не будут бить его палками. Лестер же не защитил титул)
cherdantsev|862704689183428608|2017-05-11 16:23:20|@AShmurnov 67? Да ладно! Ах&amp;₽ть!
cherdantsev|862420058823434244|2017-05-10 21:32:19|@AShmurnov Ни фига не понял. Извинити.
cherdantsev|862406437909213184|2017-05-10 20:38:12|Реал, Криштиану, Зидан -  у вас он есть и не один, у Реала их даже много. Дайте один, всего один Буффону. Por favor!
cherdantsev|862404930501578759|2017-05-10 20:32:12|@AShmurnov Разве? Решили же звезды за каждые пять чемпионств в России давать. Зенит именно на этом основании получил.
cherdantsev|862382356291891201|2017-05-10 19:02:30|Я щас закончу вообще всё! 😱😱😱#АтлетикоРеал #Лигачемпионов
cherdantsev|862060202564218880|2017-05-09 21:42:23|Отцы и дети) Одному 18, второму 39. https://t.co/2XdEZUQRgd
cherdantsev|862047813315813376|2017-05-09 20:53:09|Ювентус великолепен. Шансы в финале 50/50, но болеть буду в любом случае за Буффонище-🏆 должен быть достойным завершением блестящей карьеры
cherdantsev|861911407381680128|2017-05-09 11:51:07|Если у Зенита есть возможность договориться с Раньери, то конечно он, а не Пауло Соуза. Фиорентина очень скучная команда.
cherdantsev|861482609511206912|2017-05-08 07:27:14|Когда Спартак стал впервые чемпионом на моей памяти, мне было 8 лет (1979). Сейчас моему сыну 8. 8+8=16. Магия цифр. #мистика
cherdantsev|861481167912148992|2017-05-08 07:21:30|RT @netsenko: Такого на ЧМ не видел. Нападающий Франции Бельмар заставил отдать приз лучшего игрока матча с финнами вратарю Арди https://t.…
cherdantsev|861305879873957888|2017-05-07 19:44:58|Только что сообразил, что комментировал вчера чемпионский матч Спартака😱
cherdantsev|861299786875637761|2017-05-07 19:20:46|"RT @MatchTV: ""Никогда не целовал никакой ромбик. Сегодня — поцелую"". Глушаков и Каррера — о чемпионстве ""Спартака""

ВИДЕО: https://t.co/Leq…"
cherdantsev|861290429421158401|2017-05-07 18:43:35|"RT @MatchTV: Каррера в прямом эфире Матч ТВ ответил на вопрос, будет ли он главным тренером ""Спартака"" в следующем сезоне

https://t.co/lXf…"
cherdantsev|861290362756886528|2017-05-07 18:43:19|@VasilyKonov Я
cherdantsev|861290293072711681|2017-05-07 18:43:02|"RT @MatchTV: Денис Глушаков: Хотел выиграть чемпионат в память о дяде. В начале сезона он сказал, что мы победим

https://t.co/5fcKMYwonb h…"
cherdantsev|861283979156180992|2017-05-07 18:17:57|RT @marco_trabucchi: Нет слов https://t.co/vcdL12tVAc
cherdantsev|861279043311849472|2017-05-07 17:58:20|Спартак, с победой!!! Сейчас попробуем, чтобы Каррера поздравил болельщиков в прямом эфире @MatchTV
cherdantsev|861272430295252993|2017-05-07 17:32:03|Что сейчас делает Спартак?
cherdantsev|861198100672774144|2017-05-07 12:36:42|@EgorovSA Синяк это результат столкновения в штрафной. Сам соберись.
cherdantsev|861196561119940609|2017-05-07 12:30:35|@EgorovSA Ребят, вы что-то вразнос пошли: пенальти на Глушакове 100% не было (у человека синяк), Слуцкий в Челси (и… https://t.co/8y1Slcn8Ff
cherdantsev|860923179849715712|2017-05-06 18:24:15|То есть, когда игрок чисто выходит один на один и спотыкается о бедро соперника, это не пенальти? Ну ок. Послушаем Будогосского.
cherdantsev|860875234852917248|2017-05-06 15:13:44|Сегодня ожидается полный аншлаг - до титула осталось 4 очка без учёта матчей соперников, а… https://t.co/4K3TTDBuk8
cherdantsev|860049357420277761|2017-05-04 08:32:00|Монако дома в последний раз не забивал 1,5 года назад. Буффон не пропустил и в Барселоне. Он заслужил свой 1-й КЧ! У Роналду он уже есть)
cherdantsev|859868340973711364|2017-05-03 20:32:42|Ответные полуфиналы полная бессмыслица. #Лигачемпионов #МонакоЮвентус #UCL
cherdantsev|859848971916804096|2017-05-03 19:15:44|Мы заказывали финал Ювентус-Реал. ОК👍#ЛигаЧемпионов
cherdantsev|859840713542033408|2017-05-03 18:42:55|Аякс что сотворил!!! Я в шоке. 😱😱😱
cherdantsev|859757208082542594|2017-05-03 13:11:06|Болельщики Локо вчера были очень крутые. Задали новую планку боления на выезде в России👍Суперкубок бы сыграли не в Москве, было бы здорово!
cherdantsev|859419170647232513|2017-05-02 14:47:52|Кубок России - такой вот он! #сочи #кубокроссии #финал @ Fisht Olympic Stadium https://t.co/i5RDJ0XdpN
cherdantsev|859415123169091584|2017-05-02 14:31:47|Финал Кубка России. 18.00 @MatchTV. Не пропустите! #кубокроссии https://t.co/ExGP6Y8Hlq
cherdantsev|859098385571360768|2017-05-01 17:33:11|Гитара Пола Стэнли прямо сейчас в Олимпийском) Lick It Up 👅! #KISS https://t.co/3RDFuMi4tr
cherdantsev|859049636287348739|2017-05-01 14:19:28|Особенно рад за коллегу @AShmurnov. Он свой финал заслужил давным-давно! 👍👍👍 https://t.co/7Nz7kkpQTw
cherdantsev|858770521634332675|2017-04-30 19:50:22|Десайи сказал, что ему больше всего понравился Глушаков. #ЦСКАСпартак
cherdantsev|858751560742039554|2017-04-30 18:35:01|RT @Mosfilmovskiy: Организаторы #derbyday, потушив свет на гостевом секторе @fcsm_official , нарушили право потребителя на безопасность ока…
cherdantsev|858750562262810630|2017-04-30 18:31:03|Марсель Десайи. Человек, который выиграл в футболе все главные титулы! В 22.00 на МатчТВ… https://t.co/mBCxbrAG07
cherdantsev|858726689282678785|2017-04-30 16:56:11|Интересно, по сегодняшнему матчу опять будут претензии Спартаку по качеству игры? 😱
cherdantsev|858715723446857729|2017-04-30 16:12:37|Всё. Спартак чемпион!
cherdantsev|858697910371930112|2017-04-30 15:01:50|Безбородов устно уже предупредил Витиньо, когда тот на ногу Таски наступил. Потом наступает на ногу Ещенко. Имхо - удаление. #цскаспартак
cherdantsev|858625558888022020|2017-04-30 10:14:20|Такие матчи как сегодня и огромный интерес к ним это ещё и повод сделать что-то хорошее. #дерби #цскаспартак https://t.co/eUWtE2po8d
cherdantsev|857980177783173120|2017-04-28 15:29:49|Подписал контракт с Динамо-2 на год. К Дмитрию Хохлову. Булыкин оформил все документы.… https://t.co/FiqRwtDKII
cherdantsev|857668507688947712|2017-04-27 18:51:21|Сколько пенальти поставит Безбородов в дерби? Обсудим в 23.55.
cherdantsev|857664250516557825|2017-04-27 18:34:26|Безбородов перед дерби размялся: 3 пенальти в пользу Анжи) Имхо все можно было давать. Но два можно было и не давать) #РФПЛ
cherdantsev|857617153046044673|2017-04-27 15:27:17|Эфир сегодня поздно, но в будний день по-другому никак. Тем не менее, успеем обсудить все события тура. После футбо… https://t.co/nS9Nirrp3u
cherdantsev|857545752482119680|2017-04-27 10:43:34|RT @CentralCourt: Вчера был большой день.. Маша великая. В 12:10 на @MatchTV выйдет в эфир репортаж о том, как россиянка этот день провела…
cherdantsev|857496019101249536|2017-04-27 07:25:57|АПЛ отказала в приобретении Саутгемптона китайскому инвестору, так как тот подозревается во взятках. #репутация https://t.co/WYJG8hyqQZ
cherdantsev|857326104583032836|2017-04-26 20:10:46|"... Это магия кино😉Марадону сыграл актёр Рой Серрано. А выдаёт все тату: в кино у ""Марадоны"" на спине Карл Маркс, а у Марадоны Че Гевара)"
cherdantsev|857309898924859394|2017-04-26 19:06:22|"Это Марадона в фильме Паоло Соррентино ""Молодость"" (2015). Я в шоке. От всего. https://t.co/USmLC8eQM8"
cherdantsev|857300650820022273|2017-04-26 18:29:37|Маша, молодец! https://t.co/uvYebJ0G3B
cherdantsev|857280715226066944|2017-04-26 17:10:24|Витиньо-то как прибавил, а?!
cherdantsev|856937739039772674|2017-04-25 18:27:32|Вот если бы сейчас Беленов забил и прервал  сухую серию Медведева! Вот это был бы номер! Ведь почти попал как следует по мячу! Бердыев🔝#рфпл
cherdantsev|856927384402104321|2017-04-25 17:46:24|"@VasilyKonov Именно такой персоне может прийти в голову употребить в тексте слово ""факабельный""😭"
cherdantsev|856927026728636417|2017-04-25 17:44:58|То есть, в принципе Емельянова мало удалили. Надо было ещё раз. #специальнаябольница https://t.co/vp50K4Wqxe
cherdantsev|856926247141740544|2017-04-25 17:41:52|@VasilyKonov Это девушка писала, спорим?)
cherdantsev|856841896467058689|2017-04-25 12:06:42|Столько нервов и времени все тратят в выходные на обсуждение судейства, а на выходе штиль и никаких сенсаций. Надо немного успокоиться имхо)
cherdantsev|856800859459657728|2017-04-25 09:23:38|"Лучшая футбольная гифка, что я видел. ""Поворот Кройфа"": Нидерланды-Швеция, ЧМ-74. Кройф против Олссона. Легенде сег… https://t.co/qcZ4Z2fhDr"
cherdantsev|856480335856640001|2017-04-24 12:09:59|А что за шум? Если есть один-единственный российский арбитр, который регулярно работает на еврокубках, так пусть и судит хоть все топ-матчи.
cherdantsev|856422575794204673|2017-04-24 08:20:28|По вчерашнему Класико напрашивается вывод: три супер нападающих-перебор. Без Неймара Месси чаще брал игру на себя и вот результат.
cherdantsev|856094860998213632|2017-04-23 10:38:14|Сегодня все матчи, голы и спорные моменты тура на @MatchTV в 18.55. #рфпл https://t.co/kxFYSQnoum
cherdantsev|855838983061942273|2017-04-22 17:41:28|У Эриксена больше всех голевых передач (20) во всех соревнованиях среди игроков 5 ведущих чемпионатов. https://t.co/pt2JVNRlCN
cherdantsev|855830091645034498|2017-04-22 17:06:09|Ну если кровь, как выясняется, тогда может быть и красная... https://t.co/lIZ7qcQFE8
cherdantsev|855829129647857664|2017-04-22 17:02:19|Насчёт видеоповтора. Ну вот посмотрит судья на видео падения Мозеса. 10 раз, 20. И? Ничего же не понятно)
cherdantsev|855809514830012417|2017-04-22 15:44:23|У нас был судейский семинар неделю назад. Нам показали примеры. Агрессивная игра даже в мяч это жёлтая. Бикфалви и Глушакову.
cherdantsev|855369774691430400|2017-04-21 10:37:00|Отличный жребий. Реал-Атлетико на любителя. Ювентус-Монако - праздник для всех. #лигачемпионов
cherdantsev|855346309305438208|2017-04-21 09:03:46|Редкий отморозок. https://t.co/8MJrdUUN0I
cherdantsev|854795916846538753|2017-04-19 20:36:42|Это же надо: не пропустить в ДВУХ матчах от Барселоны! Буффонище! #БарселонаЮвентус #буффонище #лигачемпионов
cherdantsev|854779715047108608|2017-04-19 19:32:19|Пора выпускать Айтекина.
cherdantsev|854773465882255361|2017-04-19 19:07:29|Пока лучший Слуцкий #БарселонаЮвентус
cherdantsev|854716918674141184|2017-04-19 15:22:47|Итак, пора начинать готовиться к #барселонаювентус #лигачемпионов Внимание, вопрос: кто решит исход игры?
cherdantsev|854663334376984576|2017-04-19 11:49:52|Всё это не отменяет того, что Реал великий клуб,  и в его составе играют блистательные мастера. Но с судейством нужно что-то делать.
cherdantsev|854661846590255105|2017-04-19 11:43:57|RT @Now__Football: BREAKING: UEFA have today unveiled their new badge following Real Madrid’s win over Bayern Munich last night. https://t.…
cherdantsev|854449363380260864|2017-04-18 21:39:37|Пересмотрел все ключевые моменты. Испанцам, конечно, подсуживают совершенно беспардонно. Буууу.
cherdantsev|854442680822181892|2017-04-18 21:13:04|Даёшь финал Реал-Ювентус! #РеалБавария #лигачемпионов
cherdantsev|854439949336281088|2017-04-18 21:02:13|Марсело гений.
cherdantsev|854432137285644289|2017-04-18 20:31:10|Всё! Свисти!!!Дай ещё 30 минут праздника!!! 🦋 🦋 🦋!!!
cherdantsev|854429967769272320|2017-04-18 20:22:33|У меня не только бабочки, а вообще всё уже вылетело наружу 🦋 🦋 🦋
cherdantsev|854343770380398592|2017-04-18 14:40:02|@GenichK поставил на Баварию! Тсссс, только никому об этом 😱... я, кстати, тоже на Баварию 😱😱#UCL #реалбавария #лигачемпионов
cherdantsev|854312495816880128|2017-04-18 12:35:46|@GenichK поставил на Баварию! Только, тсссс, никому...😱кстати, я тоже на Баварию😱#UCL #лигачемпионов #реалбавария
cherdantsev|854297968018677760|2017-04-18 11:38:02|@VasilyKonov Мой нет) Реклама с девушками? Мне не понравилась. Я не размещаю то, что мне не нравится)
cherdantsev|854285493990813696|2017-04-18 10:48:28|Написал текст для песни проекта в жанре классического heavy metal Forces United, который… https://t.co/xb3lWCuVT9
cherdantsev|854254987203006464|2017-04-18 08:47:14|@VasilyKonov Ссылку-то дай) О чем речь?
cherdantsev|853839276601204736|2017-04-17 05:15:21|Москвичи, будьте осторожны! Страшный гололёд!!! У меня перед носом машины в лоб приехали на ровном месте! Механическая коробка на спусках!
cherdantsev|853681246630809602|2017-04-16 18:47:24|Удары 17:7 в пользу Спартака. В створ - 8:2.
cherdantsev|853679819246186497|2017-04-16 18:41:44|Самедов под чемпионство вернулся. И гол, видимо, решающий забил. #СпартакЗенит
cherdantsev|853676505741709312|2017-04-16 18:28:34|Напрасно Спартак прижался к воротам...
cherdantsev|853662945821306880|2017-04-16 17:34:41|Рука. Не нужна никакая судейская передача. Первое, на что смотрит судья - естественное или нет положение руки.
cherdantsev|853656020245250048|2017-04-16 17:07:10|Пенальти на Ивановиче?
cherdantsev|853653095385092096|2017-04-16 16:55:32|70-54 - счёт выигранных единоборств в пользу МЮ. 19-12 - счёт выигранных подкатов в пользу МЮ. Счёт - 2:0 в пользу МЮ. #MUFC #CFC
cherdantsev|853642730433654784|2017-04-16 16:14:21|Составы 🔥огонь!!! Особенно у Спартака: сверхатакующий. Риск? #СпартакЗенит https://t.co/rx9X2S39OC
cherdantsev|853626804791279616|2017-04-16 15:11:04|Мне кажется, тактически Конте Моуринью уже вздул. Так как обе фамилии по-русски не склоняются, вам осталось решить, кто кого)
