StalinGulag|869539593229565952|2017-05-30 13:02:48|Если москвичей ураган убивает и никакой помощи от МЧС, то Саратов ветер вообще снесет нахуй и никто даже не вспомнит, что такой город был
StalinGulag|869538176477671425|2017-05-30 12:57:11|МЧС всё проебали, смс-оповещение об урагане нормально не разослали - 16 погибших, пострадавшие. И как будто так и надо, никто не виноват
StalinGulag|869502590320594944|2017-05-30 10:35:46|RT @A_Kozyrev: 'Бог не фраер, он все видит'! Просо шедевр 🤣👏 https://t.co/yB6bShWqZ2
StalinGulag|869491357383094272|2017-05-30 09:51:08|О том, как бляди позабыли Бога https://t.co/teub9JBji8
StalinGulag|869485938195484672|2017-05-30 09:29:36|"Глава Орловской области на вопрос о машине епископа за 6 миллионов, ответил: Бог не фраер.Он всё видит

БЛЯДЬ В КАКОЙ ПИЗДЕЦ СТРАНЕ МЫ ЖИВЁМ"
StalinGulag|869483654585745408|2017-05-30 09:20:32|"В Думе сформируют совет видеоблогеров

— Сегодня мы обсудим как...
— Поднять экономику?
— Дурак что ли? Как ставить большие пальцы в кадре!"
StalinGulag|869466434417680384|2017-05-30 08:12:06|RT @whiskeysoda_: Скоро будут задерживать за мимику лица, за мыслепреступления и непрославление Путина. В Кремле начитались Оруэлла. https:…
StalinGulag|869459216410562560|2017-05-30 07:43:25|"Теракт, погибли 13 человек: соболезнования, ужас, паника, скорбь

Ураган, погибли 13 человек: всем похуй

Какие же вы все лицемерные мрази"
StalinGulag|869456848327520258|2017-05-30 07:34:01|"""В омском парке посетителей просят не воровать корм у белок""

Ничего святого не осталось, даже белок начали обворовывать"
StalinGulag|869307124882558976|2017-05-29 21:39:04|Новый клип Фараона дико крутой, например. Запредельный стиль для всех остальных российских музыкантов. Кто думает иначе - хуй и пидор
StalinGulag|869269102325641216|2017-05-29 19:07:58|"RT @esquireru: .@StalinGulag сравнивает ситуацию с задержанием 10-летнего мальчика на Арбате с античными трагедиями: 
https://t.co/IsvQa0WD…"
StalinGulag|869266935275560961|2017-05-29 18:59:22|Президент Франции закидал хуями рашутудей, но дружелюбно пожал руку Путину. Так Макрон чмо или нет? Не нравится мне эта нестабильность!
StalinGulag|869251613998940160|2017-05-29 17:58:29|Ссылка правильная, просто у Esquire традиционно упал сайт. Подождите
StalinGulag|869248173751111685|2017-05-29 17:44:49|Написал в Esquire о шекспировских страстях последних дней. Почитайте  https://t.co/AeTskRNWFo
StalinGulag|869210155140960256|2017-05-29 15:13:44|RT @ego_zhe: Чтобы кому-то в Монако жить было хорошо, кому-то путь туда должен быть заказан, мнение сегодняшних либералов https://t.co/VHeR…
StalinGulag|869203209033842688|2017-05-29 14:46:08|RT @DivanPolitika: В государстве задерживают за читку конституции. А вы еще считаете что у нас правовое государство https://t.co/sn69yWyN6X
StalinGulag|869200688261341184|2017-05-29 14:36:07|Зря ты расстался с бывшей. Сейчас мог бы взять её за руку и пойти гулять. Наблюдать, как ураган вырывает деревья пока тебя держит любовь ❤️
StalinGulag|869199657326567424|2017-05-29 14:32:01|"""Полиция в Москве отгоняет собак от тела убитого ураганом мужчины. Животные пришли на кровь и пытались ее слизывать с асфальта""

АПОКАЛИПСИС"
StalinGulag|869198291879251968|2017-05-29 14:26:36|Это Москва сейчас. Добро пожаловать в Россию, москвичи! Именно так выглядит 80% нашей страны, а не велодорожки и ба… https://t.co/InFjdA9BIj
StalinGulag|869196236485775360|2017-05-29 14:18:26|"Ожидание: ура, ураган, он унесёт меня в Лос-Анджелес

Реальность: ураган принёс тебя в Саратов"
StalinGulag|869194506180153344|2017-05-29 14:11:33|Собянин вызвал ураган, чтобы снести ваши дома. Шах и мат, противники реновации!
StalinGulag|869191240516063234|2017-05-29 13:58:35|Ураган! Наконец нас всех снесёт нахуй! И правильно, давно пора!
StalinGulag|869144101047992321|2017-05-29 10:51:16|"RT @carinaljordan: Я в ахуе с тех, кто за ментов. А когда их за нихуя задержат, они скажут: ""Спасибо, что задержали меня, мудака, доблестны…"
StalinGulag|869138556446531584|2017-05-29 10:29:14|Ну как там? Подкачались к лету, пацаны? https://t.co/wWpdytzLwz
StalinGulag|869126082896822276|2017-05-29 09:39:40|RT @badkaktus: Как нехватает функции лайков в телеграме вот для таких постов @StalinGulag https://t.co/epJ7uGOiI2
StalinGulag|869115636592635904|2017-05-29 08:58:09|"""Патриарх сравнил законы о гей-браках с законами фашистской Германии""

Все законы,не обязывающие платить церкви патриарх считает фашистскими"
StalinGulag|869104335820648449|2017-05-29 08:13:15|О мальчике с Гамлетом, ментах и нас любимых https://t.co/HPveIM0rDA
StalinGulag|869102124864589824|2017-05-29 08:04:28|Когда долго не заходил в твитор и пытаешься быстро прочитать всю ленту https://t.co/cLADvJ1pLK
StalinGulag|868969077028642816|2017-05-28 23:15:47|Больной ублюдок https://t.co/Wgc9V7yztQ
StalinGulag|868901408770338816|2017-05-28 18:46:53|"— Знаете, что сделает полиция США если
— Знаете, что сделают в США, если президент с друзьями 17 лет будет страну пилить? ВОТ И ЕБАЛО ЗАВАЛИ"
StalinGulag|868899140914294784|2017-05-28 18:37:53|Не высказывался о задержании мальчика-поэта, думал и так всё ясно. Но сколько же мразей вылезло! Завтра напишу в https://t.co/teub9JBji8
StalinGulag|868897061504262144|2017-05-28 18:29:37|Пришли со своих каких-то пидорских фейсбуков и контактов и давай лайки ставить. Идите выёбывайтесь в свой двор! Здесь твитор - только ретвит
StalinGulag|868895221916069888|2017-05-28 18:22:18|Тут вам не одноклассники и не контакт ебучий! Это твитор, тут ваши лайки нахуй не нужны. Ретвиты делайте, ретвиты!
StalinGulag|868892744143523840|2017-05-28 18:12:28|На биткоинах хотят разбогатеть. Специально биткоины создали, чтобы ты в своём залупасранске их на 10 рублей купил и сразу на яхту шлюх ебать
StalinGulag|868787137185030144|2017-05-28 11:12:49|RT @5th_kolonna: @StalinGulag Сказ о том, как Рамзан Ахматович совкодрочерам и сталинофилам по губам обрезанным хуем водил. От @StalinGulag…
StalinGulag|868776640826007552|2017-05-28 10:31:06|"Поражают комменты ""школьники кричат АУЕ, как так можно"". Вы охуели? У нас Путин по фене базарит (беспредел, скачуха) и президент уже 17 лет"
StalinGulag|868773484037648385|2017-05-28 10:18:34|Школьники кричат АУЕ и пинают полицейское авто. Когда взрослые потеряли достоинство, детям приходится его возвращать https://t.co/29Ol0gBvoC
StalinGulag|868762413910413313|2017-05-28 09:34:34|"""В Челябинске на фестивале красок напали на полицию. Разъяренные школьники с криками «АУЕ» пинали патрульные машины""

ШКОЛОТА СПАСЁТ РОССИЮ!"
StalinGulag|868758471293927426|2017-05-28 09:18:54|Это я https://t.co/GUPGuJP3ou
StalinGulag|868512695896731648|2017-05-27 17:02:17|"Запомни: читаешь Шекспира - ты попрошайка!
Как друг Путина просишь у государства миллиарды и получаешь их - ты патриот, держи орден"
StalinGulag|868472683410980865|2017-05-27 14:23:17|RT @pocheslob: Красивая концовка. Не толерантная, зато правильная. https://t.co/mop9GMUifs
StalinGulag|868438433030647809|2017-05-27 12:07:11|"Ставить ящики для пожертвований в храмах, собирая последнее со стариков - хорошо.
Читать Шекспира и получать благодарность прохожих - плохо"
StalinGulag|868407889957965824|2017-05-27 10:05:49|"RT @mmm97045017: О значение и смысле старой русской пословицы 
ИМ ХОТЬ ССЫ В ГЛАЗА — ВСЁ БОЖЬЯ РОСА 
https://t.co/0pPuIAxfsd"
StalinGulag|868404992931225601|2017-05-27 09:54:19|Сначала умер Рокфеллер, теперь Збигнев Бжезинский. Что-то странное готовится на Земле раз своих представителей начали эвакуировать на Нибиру
StalinGulag|868402916830449664|2017-05-27 09:46:04|"""В Петербурге лейтенант полиции признался, что ночью в опорном пункте убил подростка руками и черенком от швабры""

Мусора - позор России"
StalinGulag|868397865739182084|2017-05-27 09:25:59|Какая же всё хуйня
StalinGulag|868213375259561988|2017-05-26 21:12:53|Ёбаные гестаповцы. Просто пиздец! Ещё бы мальчику за чтение стихов наручники бы надели. Скоты https://t.co/d94YrkhRHM
StalinGulag|868211536455753731|2017-05-26 21:05:35|Посмотрите как мусора задерживают школьника за чтение стихов. Это же не вооружённые кавказцы, а простой 10-летний м… https://t.co/IHaklG2HMm
StalinGulag|868197728173666304|2017-05-26 20:10:43|RT @Sasha_Fiveg: Подписывается на жену Сталингулага в инсте. Да и на самого ;-) https://t.co/4iwIrAhEDL
StalinGulag|868196179598872580|2017-05-26 20:04:34|Идите спать. Вам завтра опять охуевать
StalinGulag|868192732430430208|2017-05-26 19:50:52|ТУТ НЕ ВСЁ ТАК ОДНОЗНАЧНО! https://t.co/6JwbYbnJwh
StalinGulag|868191427737661440|2017-05-26 19:45:41|Правильно, что за стихи задерживают. Сначала стихи читают, а потом вешаться начинают! Молитвы читайте
StalinGulag|868185620623044609|2017-05-26 19:22:36|"""Полицейские задержали в центре Москвы школьника, читавшего стихи""

Спасибо избавили город от чудища! Теперь хоть гулять без страха можно"
StalinGulag|868185077817192450|2017-05-26 19:20:27|Накатили https://t.co/vPRPQ26bUK
StalinGulag|868158906706644994|2017-05-26 17:36:27|ПАЦАНЫ, ПРОСТИТЕ, НО ОНА МЕНЯ ЗАСТАВИЛА! Срочно подписывайтесь на этот https://t.co/9q0JlKMdOo потом всё объясню https://t.co/SsLCGRjr51
StalinGulag|868154194636800001|2017-05-26 17:17:44|Скоро будет очень важное заявление
StalinGulag|868125770002178048|2017-05-26 15:24:47|RT @vittunn: Ну последний-не последний,а накатить нужно!!! https://t.co/X2Sw8nEfdE
StalinGulag|868104210314915840|2017-05-26 13:59:06|На самом деле нихуя не смешно от таких карикатур. Я ещё не всё, что положено выбухал https://t.co/Feuo4Dphna
StalinGulag|868103117514190848|2017-05-26 13:54:46|RT @yellow_duck87: ..шёл 2017й: репрессии и ложь властьимущих! // заключительного поста @StalinGulag не будет, ибо вечен он! Выпьем! https:…
StalinGulag|868100367212523524|2017-05-26 13:43:50|РЕБЯТА ВСЁ БУДЕТ ХОРОШО
StalinGulag|868089699293962241|2017-05-26 13:01:27|Об ответе Кадырова на мой последний пост https://t.co/UKaYiMyz7V
StalinGulag|868085823757062149|2017-05-26 12:46:03|RT @plushev: Лестно, но нет. Это @StalinGulag https://t.co/MBtKcDFvWu
StalinGulag|868085343819620357|2017-05-26 12:44:08|Кадыров ответил мне в своём телеграме. Пойду накачу. Теперь каждый раз как последний
StalinGulag|868066019105013761|2017-05-26 11:27:21|RT @mokriysiter: Я как и @StalinGulag извиняюсь, но это ахуенный пример биполярного расстройства у наших homo soveticus. https://t.co/LpPfZ…
StalinGulag|868051419043115008|2017-05-26 10:29:20|Божья благодать в хату! Иисус в радость, кулич в сладость, правильным православным! https://t.co/cVg3TonNcW
StalinGulag|868040691619962880|2017-05-26 09:46:42|RT @whiskeysoda_: Пехотинец Путина Кадыров в очередной раз посягнул на нашу советскую духовность. Патриоты трусливо залезли под шконки http…
StalinGulag|868036594430771200|2017-05-26 09:30:26|"Burger King предложи Усманову 1 млн рублей за рекламу в следующем видео

— Кстати, ребят, советую открыть у себя на яхте Burger King, удобно"
StalinGulag|868013453499346947|2017-05-26 07:58:28|О Кадырове, советских патриотах и моих извинениях https://t.co/uXsZV5QaDG
StalinGulag|868011157860352000|2017-05-26 07:49:21|"""Школьники пробили стену в Алтайском магазине,чтобы достать алкоголь на выпускной""

Слезы гордости на глазах. Какая отверженность и героизм!"
StalinGulag|867817345045213187|2017-05-25 18:59:12|Идите спать. Вы всё равно не пьяная выпускница
StalinGulag|867811618578739201|2017-05-25 18:36:27|Внутри себя я бухаю
StalinGulag|867801562416128000|2017-05-25 17:56:30|RT @yellow_duck87: Дано: 2 очереди на вакансию уборщиков. Найти: какая очередь длиннее: 1. уборка двора 2. уборка зубов? @StalinGulag  http…
StalinGulag|867778837693779969|2017-05-25 16:26:12|О новом Твин Пиксе: пока мы жизнь проебывали, старина Линч времени не терял и все 25 лет жестко употреблял. Теперь он всё понимает, а ты нет
StalinGulag|867768907742023680|2017-05-25 15:46:44|Если бы сейчас вся Москва не стояла в пробках, в них бы стояли солдаты НАТО
StalinGulag|867747496319213568|2017-05-25 14:21:39|Поздравим выпускников с последним звонком! Вот теперь-то они дерьма хлебнуть по-настоящему, по-взрослому, огромной бездонной ложкой!
StalinGulag|867723277044764673|2017-05-25 12:45:25|"""У уборщицы Дома приёмов Газпрома украли часы за 1 млн""

Будешь плохо учиться станешь уборщицей и возьмёшь себе водителя с красным дипломом"
StalinGulag|867717066626826240|2017-05-25 12:20:44|RT @cybertrancer: @StalinGulag: Уборщик заходит в помещение и начинает оттирать с пола кровь и подметать зубы. Виновен. https://t.co/HnBTQ9…
StalinGulag|867707770392457216|2017-05-25 11:43:48|Технологии будущего: чтобы позвонить по скайпу, нужно будет пойти на почту и заказать звонок https://t.co/pY5jcC0xHg
StalinGulag|867677825951817728|2017-05-25 09:44:49|"""Студенты питерского университета ИТМО в 7 раз выиграли чемпионат мира по программированию""

Но миллиарды из бюджета всё равно выделят не им"
StalinGulag|867657240228114433|2017-05-25 08:23:01|RT @DivanPolitika: Лицо российского государства. Когда за пряником с гавном выстраивается очередь, иначе будут хуярить кнутом https://t.co/…
StalinGulag|867648902241161216|2017-05-25 07:49:53|Почему она улыбается?! Она же мать! Какой она пример подаёт, что нужно улыбаться?! Вот же шлюха! Омерзительно! https://t.co/jHRECquQ1W
StalinGulag|867485693169291269|2017-05-24 21:01:21|Саша Спилберг озалупливает советника президента по интернету. Теперь вы видели всё! НАЧАЛОСЬ https://t.co/alHOeTlsvl
StalinGulag|867463343078084608|2017-05-24 19:32:32|Идите спать. Завтра ещё успеете заебаться
StalinGulag|867436066592129024|2017-05-24 17:44:09|"RT @losmandarinus: https://t.co/T9Gr7AdzzQ пока деятели культуры выметают зубы из Гоголь-центра, я аплодирую стоя Вождю @StalinGulag
Спасиб…"
StalinGulag|867399626743304192|2017-05-24 15:19:21|Агенты по недвижимости какие-то феноменальные бляди, даже хуже ментов и чиновников. На Колыме, мрази, будете варианты бараков подбирать!
StalinGulag|867363715200536577|2017-05-24 12:56:39|"RT @OlegFalaleev: ""Сегодня работа на государство – это выбор между скромной тихой жизнью и большим баблом""@StalinGulag о праве выбораhttp…"
StalinGulag|867356356013109250|2017-05-24 12:27:24|"Участник митинга 26 марта получил 1,5 года колонии

Полтора года за то, что против коррупции"
StalinGulag|867352330387300352|2017-05-24 12:11:24|Все новости к этому часу https://t.co/ZiUhRyfx5P
StalinGulag|867330906368954368|2017-05-24 10:46:16|Даже квас умудрились проебать https://t.co/YZx6fY8xhr
StalinGulag|867313885061279745|2017-05-24 09:38:38|Кстати, если пропустили, почитайте о том, что я писал про видеообращение Усманова к Навальному (спойлер: всё плохо) https://t.co/DEsLrqsmtB
StalinGulag|867307612790018049|2017-05-24 09:13:43|"В Москве в Mercedes Maybach бросили «коктейль Молотова»

НАЧАЛОСЬ! ЕШЬ АНАНАСЫ РЯБЧИКОВ ЖУЙ ДЕНЬ ТВОЙ ПОСЛЕДНИЙ ПРИХОДИТ БУРЖУЙ"
StalinGulag|867297989555089408|2017-05-24 08:35:28|"""Закон о запрете анонимности в мессенджерах внесен в Думу""

Со всех сторон обкладывают суки!"
StalinGulag|867290656749780992|2017-05-24 08:06:20|RT @psychopath1337: Во всём прав, блять! https://t.co/LelpiwsUUB
