StalinGulag|872733387332751361|2017-06-08 08:33:48|"""Список стран, которым Россия выдает госкредиты засекречен""

Ты больше не узнаешь сколько миллиардов Россия дала таджикам и простила узбекам"
StalinGulag|872727989288620032|2017-06-08 08:12:21|"RT @SaviorCool: Для меня  9 мая и все эти фразы о ""помню-горжусь"" из уст этих блядей - карнавал лицемерия. https://t.co/Rtv12tq7zR"
StalinGulag|872544095767547905|2017-06-07 20:01:38|Идите спать. Всё хуйня
StalinGulag|872510838472617984|2017-06-07 17:49:29|RT @sieva_s: Вот почему СССР и его приемница РФ ублюдские государства, существующие не для людей, а для чиновничьей своры https://t.co/lSlB…
StalinGulag|872503743492784128|2017-06-07 17:21:17|Хорошо, когда в стране порядок и безопасность не пустой звук. Спасибо героям, которые днём и ночью защищают страну! https://t.co/rN1YvkJkDP
StalinGulag|872445000428253185|2017-06-07 13:27:52|RT @povyshka: а дальше 5 рубашек на 10 ветеранов, 5 кусков хлеба, 5 пенсий, 5 гробов https://t.co/bgFxYunGdq
StalinGulag|872432043879256065|2017-06-07 12:36:22|"Путин: ""Я не женщина. У меня не бывает плохих дней""

Как-то слабо начал Трампа косплеить, нужно было сказать: я не баба, я человек!"
StalinGulag|872429657739730944|2017-06-07 12:26:54|"""Из 500 богатейших россиян страну покинули около трети (отказались от налогового резидентства России)""

А предатель и пятая колонна ты!"
StalinGulag|872421125111861249|2017-06-07 11:52:59|RT @naherononado: Горите, бляди, в аду. Одна из самых для меня больных тем, как всегда в лучшем исполнении, ёмко, лаконично вкратце. https:…
StalinGulag|872411458595934208|2017-06-07 11:14:35|RT @IvanGuzyaev: Напомню, что на неудавшийся разгон облаков 9 мая было потрачено 100 млн. Сколько это в квартирах? https://t.co/9GQUorXo8f
StalinGulag|872409532290535426|2017-06-07 11:06:55|"В Госдуму внесен законопроект о замене гимна РФ на «Боже, царя храни»

Хорошо, что все проблемы решены и можно хуйней заняться"
StalinGulag|872392411485523968|2017-06-07 09:58:53|О голодных играх для ветеранов, блядях и оптимизме https://t.co/eYT18lWl7e
StalinGulag|872385202349379585|2017-06-07 09:30:15|"""Саратовский Минздрав отменил приказ, обязывающий врачей сообщать в полицию о лишенных девственности школьницах""

Победа! Ебитесь спокойно"
StalinGulag|872369323452583937|2017-06-07 08:27:09|"RT @mmm97045017: Если долго плевать в могилы, то однажды могилы плюнут в ответ © Фридрих Ницше и товарищи
https://t.co/z3EHt4HJZr"
StalinGulag|872363059033112576|2017-06-07 08:02:15|Самый пиздец в квартирах для ветеранов, что одному полкомнаты и кухня, а другому полкомнаты и санузел. Устроили голодные игры для дедов
StalinGulag|872361521090842624|2017-06-07 07:56:08|"В Крыму на ДЕСЯТЬ ветеранов войны выдали ПЯТЬ однокомнатных квартир поделённых перегородками

Дед,живи в коробке из под телека, 9 мая прошло"
StalinGulag|872357831684628480|2017-06-07 07:41:29|Если хочешь испортить себе день - проснись
StalinGulag|872167419938316289|2017-06-06 19:04:51|RT @Amdi_147: Никогда ещё философские рассуждения не были так применительны к жизни в России. @StalinGulag https://t.co/QzRXg9rP2B
StalinGulag|872155934000381952|2017-06-06 18:19:13|Пью чай. Так на ваших глазах рушатся идеалы
StalinGulag|872098543561048065|2017-06-06 14:31:10|RT @_Y__A__N__A_: Они обесценили нашу собственность. Они обесценили наши жизни. Мрази никогда не остановятся, если мы их не остановим. http…
StalinGulag|872092553130192896|2017-06-06 14:07:22|"Правила русского языка: 

• Реновация – говорят лживые пидорасы

• Снос жилья и отмена права на частную собственность – говорят честные люди"
StalinGulag|872046569671053312|2017-06-06 11:04:38|RT @mokriysiter: Для нашей власти и пропогандонов мы, люди живущие в России, давно стали тошнотворной массой на которую противно тратить эф…
StalinGulag|872043482172542976|2017-06-06 10:52:22|"Патриарх приехал в Киров с кортежем из 13 машин

Не удивлюсь, если сложить все номерные знаки этих авто, получится число 666"
StalinGulag|872025357150552064|2017-06-06 09:40:21|"RT @YellDuckRF: @StalinGulag о том, что для нынешней бесчеловечной власти ты ничто и никто, хуже крысы... 
https://t.co/gWepyAprvM"
StalinGulag|872021299291275264|2017-06-06 09:24:13|"""Тюменка отвоевала сумку в схватке с разбойником, несмотря на удар бутылкой по голове""

Российские феминистки встают с колен!"
StalinGulag|871998836616646656|2017-06-06 07:54:58|Написал важную и злую телегу. Почитайте. Нельзя забывать, что мразь - это мразь https://t.co/OcEUQ0VGHK
StalinGulag|871801182502760448|2017-06-05 18:49:33|"В новой iOS сообщения не будут храниться в телефоне

Теперь товарищу майору станет проще тебя читать!"
StalinGulag|871789787140804608|2017-06-05 18:04:16|Пока весь мир смотрит презентацию Apple, твитор наблюдает за тем как Панин сосёт хуй. Интересно, где же мы все свернули не туда...
StalinGulag|871755503935926273|2017-06-05 15:48:03|"""Испанка почти 30 лет притворялась слепой, чтобы не здороваться с окружающими""

Господи! Почему я раньше так не делал! Самый годный лайфхак"
StalinGulag|871752135679070209|2017-06-05 15:34:40|RT @Bourgeois_ru: Муж заебался мироточить https://t.co/HTugsnzhWx
StalinGulag|871746579807567872|2017-06-05 15:12:35|На презентации Apple покажет жизнь, которой у тебя никогда не будет
StalinGulag|871698489339781120|2017-06-05 12:01:29|RT @tango668: Поклонская: кому какое дело? А вы со своими законами чего лезете в личную жизнь людей? https://t.co/PVQPn1JfYJ
StalinGulag|871696918396760064|2017-06-05 11:55:15|ЗАЕБИСЬ
StalinGulag|871667253087019008|2017-06-05 09:57:22|О Поклонской, блядских законах и чужих жизнях https://t.co/v0pke6mDMi
StalinGulag|871662853689835520|2017-06-05 09:39:53|Поклонская, которая за веру и царя с мужиками греховно сожительствует! А проверять девственность всё равно будут у… https://t.co/TmVpFcs8A4
StalinGulag|871661103830491136|2017-06-05 09:32:56|RT @wrwrnwch: Когда @StalinGulag выражает свои мысли практическим без обсценной лексики, то особо убедительно выходит :-) https://t.co/7dYq…
StalinGulag|871653720970465280|2017-06-05 09:03:36|"Шесть арабских государств разорвали дипотношения с Катаром за спонсирование терроризма

Называется - выгнали из борделя за разврат"
StalinGulag|871445234420461568|2017-06-04 19:15:09|"""Патриарх сравнил веру в Бога с сотовой связью""

Перестал стесняться. В открытую заявляет: с Богом поговорить хочешь? Баблишка дай - соединю"
StalinGulag|871442811085869056|2017-06-04 19:05:31|В Твери бухали. Мужик говорит: я в ВДВ служил, а ему: нихуя ты не служил. Он ружьё достал и 9 трупов. Менты выяснил… https://t.co/DxENH0nINK
StalinGulag|871411433128345600|2017-06-04 17:00:50|RT @whiskeysoda_: Путин, не умеющий включать компьютер, собирается развивать цифровой мир в стране без дорог и медицины. На кого рассчитаны…
StalinGulag|871405515879972866|2017-06-04 16:37:19|"""В Саратовской области врачей обязали сообщать в полицию о школьницах, лишенных девственности""

Теперь все узнают, что ты шлюха"
StalinGulag|871356574299820033|2017-06-04 13:22:50|Панин показывает хуй системе, пока вы трусливо прячете от неё свои глаза. Панин - Человек, а вы говно
StalinGulag|871354856036069378|2017-06-04 13:16:01|Панин - это Керуак нашего времени. Русский Берроуз! Бляди вы зашоренные! Да свободы духа Панина хватит, чтобы сделать вольной всю Россию
StalinGulag|871352731218452483|2017-06-04 13:07:34|Панин молодец! В прямом и переносном смысле кладёт хуй на все эти скрепы, блевотный патриотизм и фальшивую духовность. Будь как Панин
StalinGulag|871345082972213248|2017-06-04 12:37:11|"RT @SashaMetis: — Владимир Владимирович, что вы думаете по поводу блокчейна?
— А он помогает пилить и отмывать бабки?
— Нет.
— Тогда ничего…"
StalinGulag|871314923607003138|2017-06-04 10:37:20|В российских новостях главная новость 6 погибших в Лондоне. В Твери 9 трупов - второстепенно. Ведь дети чиновников в Лондоне, а не в Твери
StalinGulag|871313056323829760|2017-06-04 10:29:55|В Твери мужик набухался и расстрелял 9 человек. Но при этом трава - наркотик зло зло гитлер нельзя, а водочка - хорошо, пей родимую, стреляй
StalinGulag|871290042546872321|2017-06-04 08:58:28|Пишут, что у некоторых недоступен телеграм. Не забывайте скачивать TOR и пользоваться VPN. РОСКОМНАДЗОРУ ХУЙ, ЛЮДЯМ - СВОБОДУ!
StalinGulag|871270207083487233|2017-06-04 07:39:39|RT @fedoroffserg: Неожиданно позитивный @StalinGulag . Конец света близок. https://t.co/o2tK3IPrkl
StalinGulag|871153973717340162|2017-06-03 23:57:47|"Чем больше пораженческой гнуси ""у террора нет религии"", ""любовь победит"", тем чаще теракты. У террора есть религия, любовь нихуя не победит!"
StalinGulag|871091514381926400|2017-06-03 19:49:35|Идите спать. Роналду миллионы получит, а вам ещё в нищете умирать
StalinGulag|871086613153099776|2017-06-03 19:30:07|Все в твиторе сейчас такие футболисты, прямо охуеть. Ну ничего, скоро вас всех на севера отправят, будет там говно замёрзшее пинать!
StalinGulag|871054350331891713|2017-06-03 17:21:55|"RT @mmm97045017: Мёд-мёд-мёд-мёд-мед...
-Ну что, бляди, во рту сладко?
-Нет
-Все ясно, меняем стратегию. Сахар-сахар-сахар-сахар...
https:/…"
StalinGulag|871045787689644033|2017-06-03 16:47:53|Ещё в Притяжении хороший момент: пришельцы никого не трогают, тихо сидят, а родные мусора москвичей дубинками хуярят. Марсианин ближе мента
StalinGulag|871043434014019584|2017-06-03 16:38:32|Какое звание было у Сердюкова, который был министром обороны?  Старший сука лейтенант. Вот и ебало завали! Это Росс… https://t.co/2Gv2bNinKm
StalinGulag|871041357179179008|2017-06-03 16:30:17|В фильме Притяжение самое нереальное это не пришельцы, а замминистра обороны живущий в панельке на окраине города. (Да, только посмотрел)
StalinGulag|871002702402269184|2017-06-03 13:56:41|RT @MRLECTERx: Почитал, и вот прям знаете - на душе сразу тепло стало! https://t.co/Ac9WRyu7Mq
StalinGulag|870993886109470720|2017-06-03 13:21:39|"""Второго июня женщина замёрзла насмерть на остановке в Санкт-Петербурге""

Лето - мразь"
StalinGulag|870983756198408192|2017-06-03 12:41:24|Он вам не Димон https://t.co/zyK85o7qy4
StalinGulag|870973451993067521|2017-06-03 12:00:27|"RT @elenasarafonova: Браво.
Все, что вы не знали и боялись спросить о виртуальной цифровой экономике в патриархально - общинном госуд-ве ht…"
StalinGulag|870970248979206146|2017-06-03 11:47:43|"Россиян с 1 июля начнут возить в пятидневные туры в Северную Корею по системе «все включено»

На пятый день расстрел?"
StalinGulag|870947061172244480|2017-06-03 10:15:35|RT @Lelka_plohish: Наконец-то хорошие новости! Но не для тебя. Пока весь мир хвастается новыми технологиями, иди воду кипяти! https://t.co/…
StalinGulag|870944398279933952|2017-06-03 10:05:00|Господи, какая же, как говорят школьники, ЖИЗА! https://t.co/fxhzkextrH
StalinGulag|870930500856291328|2017-06-03 09:09:47|О хороших новостях, выступлении Путина и цифровой эпохе https://t.co/n4SVTybuBB
StalinGulag|870927678601297920|2017-06-03 08:58:34|2017 год. Россия. Москва. Магазин Стерлингова. Закидывают яйцами портреты великих ученых. Ёбаный зоопарк  https://t.co/EpeijJOgyl
StalinGulag|870733693685518336|2017-06-02 20:07:44|Трезвый значит грустный
StalinGulag|870694682258427906|2017-06-02 17:32:43|RT @sdkgls: Коротко о том, как надо вести беседу, когда ты официальный представитель МИД РФ. https://t.co/Auz6MXfFqK
StalinGulag|870662752313978880|2017-06-02 15:25:50|"Певицу на инвалидной коляске не пустили в Киев - вся Россия на ушах

В Мурманске детей на колясках не пустили в кафе - всем похуй

Лицемеры"
StalinGulag|870623879257042944|2017-06-02 12:51:22|"""В Мурманске в День защиты детей не пустили в кафе родителей с детьми на инвалидных колясках""

Страна дохуя духовных людей"
StalinGulag|870603947626700800|2017-06-02 11:32:10|RT @immortal_kotick: Хуй с ним, когда мэр залупосранска по фени ботает, но ебучий представитель МИДа, угрожающий заграничному журналисту -…
StalinGulag|870598862200868864|2017-06-02 11:11:58|"— Мой папа вор, а вы мои рабы! Ахахаха
— Да...
— Почему ты плачешь? Это шутка. Смейся! Смейся, сука! Смейся, раб! ЭЙ ОМОН РАСМЕШИТЕ ХОЛОПА"
StalinGulag|870595412960391168|2017-06-02 10:58:15|"Дочь пресс-секретаря президента России назвала в шутку своего отца главным вором, а россиян рабами

Шутка, от которой хочется плакать"
StalinGulag|870549329865474048|2017-06-02 07:55:08|"RT @4ever1937: ""Можно вывести Захарову из колхоза, а вот колхоз из Захаровой никогда"" https://t.co/qq3JXwoCRx"
StalinGulag|870546892509327360|2017-06-02 07:45:27|Никогда не забывайте об этом! И увеличивайте, по-возможности https://t.co/YF7tzJjpSg
StalinGulag|870367858626318336|2017-06-01 19:54:02|Как надо жить https://t.co/tIFJHFrxT1
StalinGulag|870363435825016832|2017-06-01 19:36:28|Всё-таки великий был человек! Кружку пива за пять секунд https://t.co/4A2IkfVX8a
StalinGulag|870333577283719168|2017-06-01 17:37:49|Хорошо, когда всё заебало, можно перестать беспокоиться
StalinGulag|870271690722484224|2017-06-01 13:31:54|RT @ZavPolit: Знаете, в чем охуенчик этой телеги @StalinGulag? В том, что это прочтёт и Маруся и Мага и Рамзан и даже Песков с Пу https://t…
StalinGulag|870263465360969728|2017-06-01 12:59:13|"""В Волгограде ухажер убил соперника-военнослужащего. Пришел на свидание в форме и в противогазе, чтобы дама не заметила подмены""

Бог пикапа"
StalinGulag|870259263687593986|2017-06-01 12:42:31|"""Мизулина приняла участие в Московском фестивале здоровья и безопасности детей""

ПИЗДА ЗДОРОВЬЮ ПИЗДА БЕЗОПАСНОСТИ ПИЗДА ДЕТЯМ ПИЗДА ВСЕМ"
StalinGulag|870245902103040001|2017-06-01 11:49:26|RT @Bourgeois_ru: УБЛЮДОК, МАТЬ ТВОЮ, А НУ ИДИ СЮДА, ГОВНО СОБАЧЬЕ, А, РЕШИЛ КО МНЕ ЛЕЗТЬ?.. https://t.co/uHCNAgtzFM
StalinGulag|870233320910708736|2017-06-01 10:59:26|Песков опроверг заявление Пескова о том, что Путин будет праздновать день рождения своего повара. Кажется, что это шутка, но это не шутка
StalinGulag|870216965062840320|2017-06-01 09:54:26|RT @docZLO: Слышь ты... да ты, пшёл сюда, петушок твитерский... Быстро прочитал это!!! Быстро я сказал!!! https://t.co/8rz7H3lP9P
StalinGulag|870208259382267904|2017-06-01 09:19:51|Сегодня, в день защиты детей, хочу сказать: относитесь к детям хорошо, а то они вырастут и сожгут вас нахуй! И правильно сделают
StalinGulag|870199493421142016|2017-06-01 08:45:01|RT @dpppman: А ты точно знаешь Зелимхана ? Это ебаная стагнация общества, каменный век. https://t.co/mXGUn3HADS
StalinGulag|870196324074967040|2017-06-01 08:32:25|Традиционно напоминаю, что лето наступило, а вы всё такие же жирные
StalinGulag|870185062075162624|2017-06-01 07:47:40|О Марии Захаровой, чеченцах и ночных клубах https://t.co/2vpJJvNrTq
StalinGulag|870008445667344385|2017-05-31 20:05:52|Просто вдумайтесь: официальный представитель МИДа РФ пугает журналиста Чечней. Это не позорище, это Россия сегодня https://t.co/cLFQBHRei3
StalinGulag|869998057999519746|2017-05-31 19:24:35|"RT @mimir_m: В 90-х хотя бы было понятно ху из ху, сейчас все эти отморозы спрятались под рясы и за депутатские мандаты
@StalinGulag, спаси…"
StalinGulag|869987108173352960|2017-05-31 18:41:04|Питер, такой Питер https://t.co/9vsnGi2YcW
StalinGulag|869926295131627520|2017-05-31 14:39:25|RT @youngparussia: А ты докажи, что не дар божий https://t.co/SZAW6EEDtd
StalinGulag|869919804110626816|2017-05-31 14:13:38|Уровень журналистики и свободы слова в стране: смотрим антикоррупционные расследования на порно сайте
StalinGulag|869917811925278720|2017-05-31 14:05:43|Возрождение свободной и счастливой России начнётся с порнохаба. Запомните этот твит!
StalinGulag|869910351185424384|2017-05-31 13:36:04|"""PornHub перезалил к себе фильм Навального ""Он вам не Димон"", указав категории Hardcore, Rough Sex, Double Penetrat… https://t.co/QelhnUjeuy"
StalinGulag|869889394207059968|2017-05-31 12:12:47|RT @RTit0v: Просто шикарно! Лишь бы за репост не сесть ;) https://t.co/KfrIE0Bb0s
StalinGulag|869881769784479744|2017-05-31 11:42:30|Жалко, конечно, что Борис Николаевич Ельцин не дожил до всех этих твиторов. Он побухне вам тут такой бы понимаешь устроил, охуели бы
StalinGulag|869880862732689408|2017-05-31 11:38:53|Вообще, радуйтесь, что Трамп только covfefe пишет, я бы на его месте писал: эй, ебалаи, я президент США, а вы говно! ясно вам?! Г О В Н О!
StalinGulag|869879816807383041|2017-05-31 11:34:44|"Да что вы приебались к Трампу с его ""covfefe""? Дональд как нормальный человек наебенится и сразу в твитор писать. Я тоже всегда так делаю"
StalinGulag|869852486693212161|2017-05-31 09:46:08|Это лучшее! Два айфона автору https://t.co/EQxTwSnsfD
StalinGulag|869829088302825472|2017-05-31 08:13:09|RT @whiskeysoda_: Крузак за 6 млн - это Дар Божий, а все кто думают иначе просто завидуют счастью сотрудников ЗАО РПЦ. @StalinGulag: https:…
StalinGulag|869630497542090752|2017-05-30 19:04:02|Сосать, лимита неблагодарная! Вам Москва помогает https://t.co/DSOkjcNFrP
StalinGulag|869611809522765825|2017-05-30 17:49:46|RT @anisrg: Вы не только Бога позабыли, но и вообще забыли что кроме вас хоть что-то существует. https://t.co/2oQfpEFFTE
StalinGulag|869596509414838272|2017-05-30 16:48:58|Всё правильно делали https://t.co/6EkWsqOheP
StalinGulag|869561263772323841|2017-05-30 14:28:55|RT @Yupi_or_Vodka: РПЦ - самая успешная бизнес-модель, где менеджеры не в восторге от вашего Иисуса, который на каждом шагу проповедует отр…
StalinGulag|869550612719046660|2017-05-30 13:46:36|RT @Waleryany4: Если ваша мадам читает @StalinGulag, то вы действительно нашли редкий экземпляр. https://t.co/0kpT2Yjoej
StalinGulag|869547895414022144|2017-05-30 13:35:48|Неловко получилось https://t.co/8DlZdKij5b
StalinGulag|869545592200073217|2017-05-30 13:26:39|"""В Татарстане курица снесла яйцо с надписью «Аллах».
Чудо-яйцо хозяйка курицы, сразу же отнесла в мечеть""

Фантастические люди эти верующие"
